{
  "metadata": {
    "schema_version": "quantity-gold-v2",
    "artifact_version": "2026-06-05-codex-v1",
    "artifact_name": "quantity-gold recipe dioscorides-1-25-kyphi",
    "run_id": "20260605T151037Z-codex",
    "created_at": "2026-06-05T07:14:36Z",
    "created_by": "codex",
    "updated_at": "2026-06-05T15:10:37Z",
    "updated_by": "codex",
    "reviewed_by": null,
    "source_repo": "/home/seanm/github/aetius",
    "source_commit": "4fde3ddef7203eccf1f13f9e9a9c60ca002b1651",
    "derived_repo": "/home/seanm/github/aos-recipes",
    "derived_commit": null,
    "previous_version": "20260605T071830Z-codex",
    "archive_path": "data/review/quantity_gold/archive/20260605T151037Z-codex/recipes/dioscorides-1-25-kyphi.json",
    "review_status": "accepted_for_projection",
    "content_sha256_excluding_metadata": "9d655a482c61ae2aae7dddda6c47ac3bcb96c9e5e0a9433abf95b5f5a76e0a34"
  },
  "recipe_id": "dioscorides-1-25-kyphi",
  "dataset_key": "dioscorides_book1_perfumes_resins",
  "source_recipe_file": "derived/recipe_entities/dioscorides-1-25-kyphi.json",
  "records": [
    {
      "record_id": "dioscorides-1-25-kyphi:q01",
      "record_type": "ingredient_measurement",
      "recipe_id": "dioscorides-1-25-kyphi",
      "dimension": "volume",
      "qualifier_kind": null,
      "temporal_label": null,
      "review_status": "accepted_for_projection",
      "source": {
        "text": "ἡμίξεστον",
        "span": {
          "source_span": "ἡμίξεστον",
          "line_citations": [
            "28.20"
          ]
        },
        "source_text_field": "text"
      },
      "target": {
        "target_type": "ingredient",
        "source_span": "κυπέρου",
        "normalized_label": null,
        "canonical_id": null,
        "note": null
      },
      "value": {
        "kind": "fraction",
        "rational": {
          "numerator": 1,
          "denominator": 2
        },
        "display": "1/2",
        "raw_number": "ἡμι-",
        "normalized_unit": "xestes",
        "source_value": "ἡμίξεστον",
        "reference": null
      },
      "raw_unit": "ἡμίξεστον",
      "normalized_unit": "xestes",
      "evidence": "The fused form ἡμίξεστον denotes one-half of a xestes and is the explicit quantity for cyperus.",
      "notes": [],
      "provenance": {
        "generated_by": "codex",
        "generated_at": "2026-06-05T07:14:36Z",
        "run_id": "20260605T071436Z-codex",
        "method": "codex-authored reviewed seed from prior quantity-gold pass",
        "note": "The fused form ἡμίξεστον denotes one-half of a xestes and is the explicit quantity for cyperus."
      },
      "created_at": "2026-06-05T07:14:36Z",
      "created_by": "codex",
      "updated_at": "2026-06-05T07:14:36Z",
      "updated_by": "codex",
      "reviewed_by": null,
      "supersedes": null
    },
    {
      "record_id": "dioscorides-1-25-kyphi:q02",
      "record_type": "ingredient_measurement",
      "recipe_id": "dioscorides-1-25-kyphi",
      "dimension": "volume",
      "qualifier_kind": null,
      "temporal_label": null,
      "review_status": "accepted_for_projection",
      "source": {
        "text": "τὸ αὐτό",
        "span": {
          "source_span": "τὸ αὐτό",
          "line_citations": [
            "28.20"
          ]
        },
        "source_text_field": "text"
      },
      "target": {
        "target_type": "ingredient",
        "source_span": "ἀρκευθίδος ἁδρᾶς",
        "normalized_label": null,
        "canonical_id": null,
        "note": null
      },
      "value": {
        "kind": "fraction",
        "rational": {
          "numerator": 1,
          "denominator": 2
        },
        "display": "same as previous amount (1/2)",
        "raw_number": "τὸ αὐτό",
        "normalized_unit": "xestes",
        "source_value": "τὸ αὐτό",
        "reference": {
          "relation": "same_as",
          "record_id": "dioscorides-1-25-kyphi:q01",
          "note": "Antecedent quantity carried over by τὸ αὐτό."
        }
      },
      "raw_unit": null,
      "normalized_unit": "xestes",
      "evidence": "τὸ αὐτό anaphorically repeats the immediately preceding half-xestes quantity.",
      "notes": [],
      "provenance": {
        "generated_by": "codex",
        "generated_at": "2026-06-05T07:14:36Z",
        "run_id": "20260605T071436Z-codex",
        "method": "codex-authored reviewed seed from prior quantity-gold pass",
        "note": "τὸ αὐτό anaphorically repeats the immediately preceding half-xestes quantity."
      },
      "created_at": "2026-06-05T07:14:36Z",
      "created_by": "codex",
      "updated_at": "2026-06-05T07:14:36Z",
      "updated_by": "codex",
      "reviewed_by": null,
      "supersedes": null
    },
    {
      "record_id": "dioscorides-1-25-kyphi:q03",
      "record_type": "ingredient_measurement",
      "recipe_id": "dioscorides-1-25-kyphi",
      "dimension": "weight",
      "qualifier_kind": null,
      "temporal_label": null,
      "review_status": "accepted_for_projection",
      "source": {
        "text": "μνᾶς δεκαδύο",
        "span": {
          "source_span": "μνᾶς δεκαδύο",
          "line_citations": [
            "28.20"
          ]
        },
        "source_text_field": "text"
      },
      "target": {
        "target_type": "ingredient",
        "source_span": "σταφίδος λιπαρᾶς ἐκγεγιγαρτισμένης",
        "normalized_label": null,
        "canonical_id": null,
        "note": null
      },
      "value": {
        "kind": "integer",
        "rational": {
          "numerator": 12,
          "denominator": 1
        },
        "display": "12",
        "raw_number": "δεκαδύο",
        "normalized_unit": "mna",
        "source_value": "μνᾶς δεκαδύο",
        "temporal_label": null,
        "reference": null
      },
      "raw_unit": "μνᾶς",
      "normalized_unit": "mna",
      "evidence": "The phrase explicitly gives twelve mnas of pitted rich raisins.",
      "notes": [],
      "provenance": {
        "generated_by": "codex",
        "generated_at": "2026-06-05T07:14:36Z",
        "run_id": "20260605T071436Z-codex",
        "method": "codex-authored reviewed seed from prior quantity-gold pass",
        "note": "The phrase explicitly gives twelve mnas of pitted rich raisins."
      },
      "created_at": "2026-06-05T07:14:36Z",
      "created_by": "codex",
      "updated_at": "2026-06-05T07:14:36Z",
      "updated_by": "codex",
      "reviewed_by": null,
      "supersedes": null
    },
    {
      "record_id": "dioscorides-1-25-kyphi:q04",
      "record_type": "ingredient_measurement",
      "recipe_id": "dioscorides-1-25-kyphi",
      "dimension": "weight",
      "qualifier_kind": null,
      "temporal_label": null,
      "review_status": "accepted_for_projection",
      "source": {
        "text": "μνᾶς πέντε",
        "span": {
          "source_span": "μνᾶς πέντε",
          "line_citations": [
            "29.1"
          ]
        },
        "source_text_field": "text"
      },
      "target": {
        "target_type": "ingredient",
        "source_span": "ῥητίνης ἀποκεκαθαρμένης",
        "normalized_label": null,
        "canonical_id": null,
        "note": null
      },
      "value": {
        "kind": "integer",
        "rational": {
          "numerator": 5,
          "denominator": 1
        },
        "display": "5",
        "raw_number": "πέντε",
        "normalized_unit": "mna",
        "source_value": "μνᾶς πέντε",
        "temporal_label": null,
        "reference": null
      },
      "raw_unit": "μνᾶς",
      "normalized_unit": "mna",
      "evidence": "The resin amount is stated directly as five mnas.",
      "notes": [],
      "provenance": {
        "generated_by": "codex",
        "generated_at": "2026-06-05T07:14:36Z",
        "run_id": "20260605T071436Z-codex",
        "method": "codex-authored reviewed seed from prior quantity-gold pass",
        "note": "The resin amount is stated directly as five mnas."
      },
      "created_at": "2026-06-05T07:14:36Z",
      "created_by": "codex",
      "updated_at": "2026-06-05T07:14:36Z",
      "updated_by": "codex",
      "reviewed_by": null,
      "supersedes": null
    },
    {
      "record_id": "dioscorides-1-25-kyphi:q05",
      "record_type": "ingredient_measurement",
      "recipe_id": "dioscorides-1-25-kyphi",
      "dimension": "weight",
      "qualifier_kind": null,
      "temporal_label": null,
      "review_status": "accepted_for_projection",
      "source": {
        "text": "ἑκάστου μνᾶν μίαν",
        "span": {
          "source_span": "ἑκάστου μνᾶν μίαν",
          "line_citations": [
            "29.1"
          ]
        },
        "source_text_field": "text"
      },
      "target": {
        "target_type": "ingredient",
        "source_span": "καλάμου ἀρωματίτου",
        "normalized_label": null,
        "canonical_id": null,
        "note": "One of three ingredients governed by ἑκάστου."
      },
      "value": {
        "kind": "integer",
        "rational": {
          "numerator": 1,
          "denominator": 1
        },
        "display": "1",
        "raw_number": "μίαν",
        "normalized_unit": "mna",
        "source_value": "ἑκάστου μνᾶν μίαν",
        "temporal_label": null,
        "reference": null
      },
      "raw_unit": "μνᾶν",
      "normalized_unit": "mna",
      "evidence": "The distributive ἑκάστου assigns one mna to calamus.",
      "notes": [],
      "provenance": {
        "generated_by": "codex",
        "generated_at": "2026-06-05T07:14:36Z",
        "run_id": "20260605T071436Z-codex",
        "method": "codex-authored reviewed seed from prior quantity-gold pass",
        "note": "The distributive ἑκάστου assigns one mna to calamus."
      },
      "created_at": "2026-06-05T07:14:36Z",
      "created_by": "codex",
      "updated_at": "2026-06-05T07:14:36Z",
      "updated_by": "codex",
      "reviewed_by": null,
      "supersedes": null
    },
    {
      "record_id": "dioscorides-1-25-kyphi:q06",